{
  "academic_level": "A2",
  "allowed_wording": [
    "MoP-Forge measures narrow verified 100M code-repair efficiency on the fixed L4 report split."
  ],
  "artifact_audit": {
    "blocked_artifacts": [],
    "blocked_suffixes": [
      ".bin",
      ".ckpt",
      ".npy",
      ".npz",
      ".pt",
      ".pth",
      ".safetensors"
    ],
    "checked": true,
    "passed": true,
    "weights_allowed": false
  },
  "baselines": [
    "20260621T201304Z-verified-code-repair-100m-l4-dense-475621f6",
    "20260621T204500Z-verified-code-repair-100m-l4-mop-full-f663b186"
  ],
  "blocked_wording": [
    "Qwen-class, frontier-class, or generally useful code-model quality without external benchmark evidence.",
    "Production-grade managed training service without reliability, security, monitoring, recovery, and support evidence.",
    "Guaranteed 1B/2B training on unseen hardware.",
    "Same-quality sparse superiority without same-split quality gates and repeated evidence.",
    "Customer-proven cost savings without external pilot results."
  ],
  "claim_card_format": "mopforge_claim_card_v1",
  "claim_id": "verified_code_repair_100m_l4",
  "claim_statement": "MoP-Forge measures narrow verified 100M code-repair efficiency on the fixed L4 report split.",
  "claim_type": "benchmark",
  "commit": "e9b96e4c3422d028614dcd2a04b78d1351c79582",
  "created_utc": "2026-06-24T22:53:08.066763+00:00",
  "dataset": {
    "name": "verified_code_repair_100m_l4@20260621T195340Z-coding-bugfix-efficiency-191c4bc8",
    "quality_format": "fixed_code_xml",
    "split_id": "split-seed42-train80-eval10-test10-by-bug-type",
    "split_seed": 42,
    "stratify_by": "bug_type"
  },
  "decision": "publish-narrowly",
  "evidence_files": [
    "reports/verified_code_repair_100m_l4/acceptance_gates.json",
    "reports/verified_code_repair_100m_l4/claim_card.json",
    "reports/verified_code_repair_100m_l4/claim_validation.json",
    "reports/verified_code_repair_100m_l4/comparison.csv",
    "reports/verified_code_repair_100m_l4/comparison.json",
    "reports/verified_code_repair_100m_l4/experiment_settings.json",
    "reports/verified_code_repair_100m_l4/README.md",
    "reports/verified_code_repair_100m_l4/report_manifest.json",
    "reports/verified_code_repair_100m_l4/run_manifest.json",
    "reports/verified_code_repair_100m_l4/runs/cached_warm_adapter_norm_head_128/config.json",
    "reports/verified_code_repair_100m_l4/runs/cached_warm_adapter_norm_head_128/generation_eval.json",
    "reports/verified_code_repair_100m_l4/runs/cached_warm_adapter_norm_head_128/gpu_training_result.json",
    "reports/verified_code_repair_100m_l4/runs/cached_warm_adapter_norm_head_128/ground_truth_controls.json",
    "reports/verified_code_repair_100m_l4/runs/cached_warm_adapter_norm_head_128/memory_estimate.json",
    "reports/verified_code_repair_100m_l4/runs/cached_warm_adapter_norm_head_128/metrics.json",
    "reports/verified_code_repair_100m_l4/runs/cached_warm_adapter_norm_head_128/runtime.json",
    "reports/verified_code_repair_100m_l4/runs/cached_warm_adapter_norm_head_128/state.json",
    "reports/verified_code_repair_100m_l4/runs/cached_warm_lora_rank8/config.json",
    "reports/verified_code_repair_100m_l4/runs/cached_warm_lora_rank8/generation_eval.json",
    "reports/verified_code_repair_100m_l4/runs/cached_warm_lora_rank8/gpu_training_result.json",
    "reports/verified_code_repair_100m_l4/runs/cached_warm_lora_rank8/ground_truth_controls.json",
    "reports/verified_code_repair_100m_l4/runs/cached_warm_lora_rank8/memory_estimate.json",
    "reports/verified_code_repair_100m_l4/runs/cached_warm_lora_rank8/metrics.json",
    "reports/verified_code_repair_100m_l4/runs/cached_warm_lora_rank8/runtime.json",
    "reports/verified_code_repair_100m_l4/runs/cached_warm_lora_rank8/state.json",
    "reports/verified_code_repair_100m_l4/runs/dense/config.json",
    "reports/verified_code_repair_100m_l4/runs/dense/generation_eval.json",
    "reports/verified_code_repair_100m_l4/runs/dense/gpu_training_result.json",
    "reports/verified_code_repair_100m_l4/runs/dense/ground_truth_controls.json",
    "reports/verified_code_repair_100m_l4/runs/dense/memory_estimate.json",
    "reports/verified_code_repair_100m_l4/runs/dense/metrics.json",
    "reports/verified_code_repair_100m_l4/runs/dense/runtime.json",
    "reports/verified_code_repair_100m_l4/runs/dense/state.json",
    "reports/verified_code_repair_100m_l4/runs/mop_full/config.json",
    "reports/verified_code_repair_100m_l4/runs/mop_full/generation_eval.json",
    "reports/verified_code_repair_100m_l4/runs/mop_full/gpu_training_result.json",
    "reports/verified_code_repair_100m_l4/runs/mop_full/ground_truth_controls.json",
    "reports/verified_code_repair_100m_l4/runs/mop_full/memory_estimate.json",
    "reports/verified_code_repair_100m_l4/runs/mop_full/metrics.json",
    "reports/verified_code_repair_100m_l4/runs/mop_full/runtime.json",
    "reports/verified_code_repair_100m_l4/runs/mop_full/state.json",
    "reports/verified_code_repair_100m_l4/runs/warm_adapter_norm_head_128/config.json",
    "reports/verified_code_repair_100m_l4/runs/warm_adapter_norm_head_128/generation_eval.json",
    "reports/verified_code_repair_100m_l4/runs/warm_adapter_norm_head_128/gpu_training_result.json",
    "reports/verified_code_repair_100m_l4/runs/warm_adapter_norm_head_128/ground_truth_controls.json",
    "reports/verified_code_repair_100m_l4/runs/warm_adapter_norm_head_128/memory_estimate.json",
    "reports/verified_code_repair_100m_l4/runs/warm_adapter_norm_head_128/metrics.json",
    "reports/verified_code_repair_100m_l4/runs/warm_adapter_norm_head_128/runtime.json",
    "reports/verified_code_repair_100m_l4/runs/warm_adapter_norm_head_128/state.json"
  ],
  "evidence_status": "measured",
  "hardware": {
    "device": "google_colab_l4",
    "memory_gb": "unknown",
    "precision": "bf16"
  },
  "limitations": [
    "Claim is scoped to the named report directory, dataset split, seed, hardware target, and training budget.",
    "Large checkpoints, caches, token shards, optimizer states, and model weights are not part of the lightweight evidence bundle.",
    "Pilot readiness remains scoped to the measured workflow and hardware target."
  ],
  "metrics": {
    "acceptance_check_count": 13,
    "acceptance_gate_passed": true,
    "baseline_count": 2,
    "best_cached_best_eval_loss": 0.003662723351328168,
    "best_cached_checkpoint_reduction_vs_dense_x": 127.5288,
    "best_cached_checkpoint_size_mb": 7.7412,
    "best_cached_eval_loss": 0.004090624690346886,
    "best_cached_exact_match_delta_vs_dense": 0.056,
    "best_cached_exact_match_rate": 0.88,
    "best_cached_peak_allocated_gb": 0.045,
    "best_cached_peak_allocated_reduction_vs_dense_x": 36.5244,
    "best_cached_peak_reserved_gb": 0.0605,
    "best_cached_peak_reserved_reduction_vs_dense_x": 31.7025,
    "best_cached_run_id": "20260621T214425Z-verified-code-repair-100m-l4-cached-warm-adapter-norm-head-128-65c0e025",
    "best_cached_throughput_vs_dense_x": 8.3451,
    "best_cached_tokens_per_sec": 69671.2921,
    "best_cached_verifier_delta_vs_dense": 0.056,
    "best_cached_verifier_pass_rate": 0.88,
    "dense_best_eval_loss": 0.010776964981982018,
    "dense_checkpoint_size_mb": 987.2261,
    "dense_eval_loss": 0.03968046770372893,
    "dense_exact_match_rate": 0.824,
    "dense_peak_allocated_gb": 1.6436,
    "dense_peak_reserved_gb": 1.918,
    "dense_run_id": "20260621T201304Z-verified-code-repair-100m-l4-dense-475621f6",
    "dense_tokens_per_sec": 8348.7582,
    "dense_verifier_pass_rate": 0.824,
    "has_acceptance_gates_json": true,
    "has_comparison_json": true,
    "has_readiness_summary_json": false,
    "has_report_schema_json": false,
    "max_full_eval_examples": 1000,
    "max_optimizer_updates": 2000,
    "profile_evidence_count": 5,
    "run_count": 5
  },
  "product_level": "P2",
  "report_dir": "reports/verified_code_repair_100m_l4",
  "version": "0.46.0"
}